S6/Segurança Informática/TrabalhoPrático/outputs/benchmark_results.csv

Algoritmo,Nivel_Seguranca,Transacoes,Tempo_Medio_KeyGen_MS,Tempo_Medio_Trancar_MS,Tempo_Medio_Destrancar_MS,Tamanho_Chave_Pub_Bytes,Tamanho_Cifra_Bytes,Pico_Memoria_KB
RSA-2048,Standard,10,34.76447320426814,0.06594330043299124,0.5319192991009913,451,256,3.6005859375
ML-KEM-512,Standard,10,0.09508630027994514,0.026450102450326085,0.01572010078234598,800,768,12.9453125
Hibrido-RSA+MLKEM,Transicao,10,23.335318799945526,0.06281370151555166,0.47725650219945237,1251,1024,4.5400390625
RSA-2048,Standard,50,41.836515202885494,0.032131879997905344,0.4837801191024482,451,256,3.6220703125
ML-KEM-512,Standard,50,0.008997621189337224,0.01769161899574101,0.014669479860458523,800,768,5.8564453125
Hibrido-RSA+MLKEM,Transicao,50,38.74344819923863,0.05976318003376946,0.5622650796431117,1251,1024,5.1806640625
RSA-2048,Standard,100,38.71479459630791,0.03352229003212415,0.472045180213172,451,256,5.2705078125
ML-KEM-512,Standard,100,0.008133830706356093,0.017512229533167556,0.014951630582800135,800,768,10.1533203125
Hibrido-RSA+MLKEM,Transicao,100,34.828132996335626,0.05951601953711361,0.5351615889230743,1251,1024,8.3994140625

S6/Segurança Informática/TrabalhoPrático/README.md

### 1. The CPU Paradigm Shift

Lattice-based operations (**ML-KEM-512**) present an outstanding advantage in processing efficiency over traditional prime factorization mathematics. At a batch load of 100 transactions, ML-KEM executes Key Generation loops in a negligible **0.0081 ms**, effectively running **4,700x faster** than traditional **RSA-2048 (38.7148 ms)**. Server-side decryption (Decapsulation) drops from **0.4720 ms** in RSA down to a swift **0.0150 ms** in ML-KEM. This proves that quantum-resistant migration will significantly alleviate transactional CPU strain on web backends.

### 3. The Memory Allocation Penalty

Hardware profiling via `tracemalloc` confirms that the mathematical structure of matrix vectors expands the memory heap footprint during initialization cycles. At standard transactional batches, the peak memory allocation for **ML-KEM-512 (10.15 KB)** climbs to **double** the size required by traditional **RSA-2048 (5.27 KB)**. High-throughput gateways migrating to PQC must account for enhanced system RAM provisioning to hold lattice algebraic parameters in current working contexts.